{"after":{"design_sha256":"2222222222222222222222222222222222222222222222222222222222222222","plan_sha256":"1111111111111111111111111111111111111111111111111111111111111111"},"before":{"design_sha256":"4444444444444444444444444444444444444444444444444444444444444444","plan_sha256":"3333333333333333333333333333333333333333333333333333333333333333"},"context":{"constraints_sha256":"6666666666666666666666666666666666666666666666666666666666666666","implications_sha256":"7777777777777777777777777777777777777777777777777777777777777777","objective_sha256":"5555555555555555555555555555555555555555555555555555555555555555"},"event_refs":["EV-AR0058-GATE"],"formal_spec":{"result_sha256":"9999999999999999999999999999999999999999999999999999999999999999","review_sha256":"aaaaaaaaaaaaaaaaaaaaaaaaaaaaaaaaaaaaaaaaaaaaaaaaaaaaaaaaaaaaaaaa","specification_sha256":"8888888888888888888888888888888888888888888888888888888888888888","status":"pass"},"gate_type":"review","privacy_projection":{"projection_sha256":"bbbbbbbbbbbbbbbbbbbbbbbbbbbbbbbbbbbbbbbbbbbbbbbbbbbbbbbbbbbbbbbb","public_safe":true,"redacted_fields":["objective","constraints","implications"]},"schema_version":1,"task":{"id":"AR-0058","revision":1},"unresolved":false,"user_disposition":"accepted"}
